<?xml version="1.0" encoding="UTF-8"?>
<xs:schema xmlns:xs="http://www.w3.org/2001/XMLSchema"
           elementFormDefault="qualified">

    <!-- Elemento raíz -->
    <xs:element name="agencia">
        <xs:complexType>
            <xs:sequence>
                <xs:element name="paquete" maxOccurs="unbounded">
                    <xs:complexType>
                        <xs:sequence>
                            <xs:element name="destino" type="xs:string"/>
                            <xs:element name="precio">
                                <xs:simpleType>
                                    <xs:restriction base="xs:decimal">
                                        <xs:minExclusive value="0"/>
                                    </xs:restriction>
                                </xs:simpleType>
                            </xs:element>
                            <xs:element name="fechaInicio" type="xs:date"/>
                            <xs:element name="fechaFin" type="xs:date"/>
                            <xs:element name="tipo">
                                <xs:simpleType>
                                    <xs:restriction base="xs:string">
                                        <xs:enumeration value="Aventura"/>
                                        <xs:enumeration value="Relax"/>
                                        <xs:enumeration value="Cultural"/>
                                        <xs:enumeration value="Familiar"/>
                                    </xs:restriction>
                                </xs:simpleType>
                            </xs:element>
                            <xs:element name="clientes">
                                <xs:complexType>
                                    <xs:sequence>
                                        <xs:element name="cliente" maxOccurs="unbounded">
                                            <xs:complexType>
                                                <xs:sequence>
                                                    <xs:element name="nombre">
                                                        <xs:simpleType>
                                                            <xs:restriction base="xs:string">
                                                                <xs:pattern value="[A-Z][a-záéíóúñÁÉÍÓÚÑ\s]+"/>
                                                            </xs:restriction>
                                                        </xs:simpleType>
                                                    </xs:element>
                                                    <xs:element name="dni">
                                                        <xs:simpleType>
                                                            <xs:restriction base="xs:string">
                                                                <xs:pattern value="[0-9]{8}[A-Z]"/>
                                                            </xs:restriction>
                                                        </xs:simpleType>
                                                    </xs:element>
                                                    <xs:element name="edad">
                                                        <xs:simpleType>
                                                            <xs:restriction base="xs:integer">
                                                                <xs:minInclusive value="18"/>
                                                                <xs:maxInclusive value="99"/>
                                                            </xs:restriction>
                                                        </xs:simpleType>
                                                    </xs:element>
                                                    <xs:element name="email">
                                                        <xs:simpleType>
                                                            <xs:restriction base="xs:string">
                                                                <xs:pattern value="[a-zA-Z0-9._%+-]+@[a-zA-Z0-9.-]+\.[a-zA-Z]{2,}"/>
                                                            </xs:restriction>
                                                        </xs:simpleType>
                                                    </xs:element>
                                                </xs:sequence>
                                            </xs:complexType>
                                        </xs:element>
                                    </xs:sequence>
                                </xs:complexType>
                            </xs:element>
                        </xs:sequence>
                        <xs:attribute name="codigo" use="required">
                            <xs:simpleType>
                                <xs:restriction base="xs:string">
                                    <xs:pattern value="PKT-[0-9]{4}"/>
                                </xs:restriction>
                            </xs:simpleType>
                        </xs:attribute>
                    </xs:complexType>
                </xs:element>
            </xs:sequence>
        </xs:complexType>

        <!-- Restricción de fechas (fechaFin > fechaInicio) usando clave asertiva en XSD 1.1 -->
        <xs:assert test="every $p in paquete satisfies xs:date($p/fechaFin) gt xs:date($p/fechaInicio)"/>
    </xs:element>

</xs:schema>