<?xml version="1.0" encoding="UTF-8"?>
<agencia xmlns:xsi="http://www.w3.org/2001/XMLSchema-instance"
         xsi:noNamespaceSchemaLocation="agencia.xsd">

    <paquete codigo="PKT-1001">
        <destino>París</destino>
        <precio>1250.50</precio>
        <fechaInicio>2025-06-10</fechaInicio>
        <fechaFin>2025-06-20</fechaFin>
        <tipo>Cultural</tipo>
        <clientes>
            <cliente>
                <nombre>María López</nombre>
                <dni>12345678A</dni>
                <edad>30</edad>
                <email>maria.lopez@example.com</email>
            </cliente>
            <cliente>
                <nombre>Juan Pérez</nombre>
                <dni>87654321B</dni>
                <edad>45</edad>
                <email>juan.perez@example.com</email>
            </cliente>
        </clientes>
    </paquete>

    <paquete codigo="PKT-2002">
        <destino>Costa Rica</destino>
        <precio>1899.99</precio>
        <fechaInicio>2025-11-01</fechaInicio>
        <fechaFin>2025-11-15</fechaFin>
        <tipo>Aventura</tipo>
        <clientes>
            <cliente>
                <nombre>Laura García</nombre>
                <dni>33445566C</dni>
                <edad>28</edad>
                <email>laura.garcia@example.com</email>
            </cliente>
            <cliente>
                <nombre>Carlos Díaz</nombre>
                <dni>44556677D</dni>
                <edad>39</edad>
                <email>carlos.diaz@example.com</email>
            </cliente>
        </clientes>
    </paquete>

</agencia>